name,content,score,create_time,user_url
圣洁,优异的。绝对推荐，地理位置极佳，员工热情，服务周到，房间风格明显，颇有情调。,5,2019/7/12,https://m.mafengwo.cn/nb/public/sharejump.php?type=25&uid=95276330
Zhaoping,非常好。地c非常好 一出砭褪峭。,5,2019/7/12,https://m.mafengwo.cn/nb/public/sharejump.php?type=25&uid=95273328
宣慈,好。位置在外，方便走走逛逛，酒店本身就是一个景c，餐品多味道不e！T工不热情不I，k理入住r的T工根本不主咏榻B酒店的服蘸驮O施，等我才回答，中间]有微笑和Y貌用语。反而入住r另外一名外籍T工送了个公仔o哄宝_心。不^後续也]有人我上房间介B，@_不是星店的服省Ｈ胱∑陂g推着很多次在停鋈肟诖砘兀]有人臀_T也]有人上前，只有白天上班r间在大堂电梯口才看到服赵保拇筇玫讲d到酒吧o我的感受就是普遍人o崆楹头务质量可言，反而ν饧人士sB度和@得多，硬件O施很好，但软件在配不上上海的老字号酒店。,5,2019/7/12,https://m.mafengwo.cn/nb/public/sharejump.php?type=25&uid=95277113
Yizola,"酒店中庭，都是鲜花，很多电影取景地。
房内设施很赞，特别是洗护用品
自助早餐非常棒，露台风景独好。",5,2018/7/3,https://m.mafengwo.cn/nb/public/sharejump.php?type=25&uid=87337705
山河入梦,优异的。值得w的一家老字店。上海的岫缺容^高 床都有c竦摹,5,2019/7/12,https://m.mafengwo.cn/nb/public/sharejump.php?type=25&uid=95277569
世民,优异的。爵士酒吧绝对是最大特色！历史悠久设施却翻新得很成功。房间结构设计很合理，比同类五星好很多。,5,2019/7/12,https://m.mafengwo.cn/nb/public/sharejump.php?type=25&uid=95274632
Zhengxian,优异的。店很美，O浜馨簦整w舒m度很不e。,5,2019/7/12,https://m.mafengwo.cn/nb/public/sharejump.php?type=25&uid=95273460
Антон,去上海一定要体验一下和平饭店。枕头很舒服，床很高很大，备注了加婴儿床，到了酒店发现还加了热奶器，婴儿洗漱用品，婴儿浴盆，挺贴心的，很多细节都做得不错。爵士酒吧有一种穿越回老上海的感觉，天台酒吧看夜景很好。暂时没有。,5,2019/7/12,https://m.mafengwo.cn/nb/public/sharejump.php?type=25&uid=95274371
半清半醒半明白,还是很值得住一晚浪漫一下。房间服务非常好，而且很大，设备齐全，有胶囊咖啡。地理位置好到不行。没有USB充电口，酒店早餐一般，下午茶虽然是免费的，可惜没有风景看。,5,2019/7/12,https://m.mafengwo.cn/nb/public/sharejump.php?type=25&uid=95272741
Zhouyouforfun,优异的。地理位置一流，装修很有老上海的风情。员工某些时候可以再专业一些。,5,2019/7/12,https://m.mafengwo.cn/nb/public/sharejump.php?type=25&uid=95273849
Zhuonan,优异的。地理位置极好，酒店恰到好处地融合了老上海的风情和新上海的现代，每次去都给人留下极为深刻而难忘的印象。虽然绝大部分员工都非常友善和热情，但也有部分员工可能还可以更专业一些。,5,2019/7/12,https://m.mafengwo.cn/nb/public/sharejump.php?type=25&uid=95273915
巢徽,优异的。整体来说非常好，下次会再来．。,5,2019/7/12,https://m.mafengwo.cn/nb/public/sharejump.php?type=25&uid=95277634
,优异的。和平饭店整栋楼都是老建筑，能维护成这样真的很不容易。他们的服务，可能要数得上五星级标杆了吧。那个态度既不会让你感到过分殷勤又不会让你觉得疏离高傲，不像是被培训出来的标准流程，而是真的为顾客在着想。周到和贴心表现在很多细节方面，给人一种就像被一个旧上海女主人温柔款待的感觉。下次肯定还会住和平饭店。想尝试一下九国套房。基本上是完美的。,5,2019/7/12,https://m.mafengwo.cn/nb/public/sharejump.php?type=25&uid=95276458
康强,尚可。好像]有什N特eM意的。前_接待r冷冰冰，]有介B房g及酒店，]有笑容；除了套房有外╋L景外，其他房g拥停]有L景；早餐我唬不具特色；房gO施比^老f，]有F代化，R桶不是子的，窗]有樱凰^的迎e水果就是三O果，而且]有洗。,5,2019/7/12,https://m.mafengwo.cn/nb/public/sharejump.php?type=25&uid=95277763
十起个名字真难,一个酒店 可以浓缩一个城市 一段历史的 非和平饭店莫属了 到上海旅游 入住和平饭店 感受上海滩昔日的繁华 历经军事 经济和政治的动荡 古典与现代的融合 所谓行千里路胜读万卷书的体验吧,5,2018/3/7,https://m.mafengwo.cn/nb/public/sharejump.php?type=25&uid=84077433
亮竹,令人愉悦。交通便利，离外滩很近。早餐性价比一般，住宿价格加收服务费，但是实际房间设施一般，并无特别之处。,5,2019/7/12,https://m.mafengwo.cn/nb/public/sharejump.php?type=25&uid=95274896
蚂蜂窝用户,很好的酒店，去上海可以去体验一下,5,2018/2/25,https://m.mafengwo.cn/nb/public/sharejump.php?type=25&uid=94367915
波波,服务好、地段好、有逼格的酒店、下次还来,5,2018/2/24,https://m.mafengwo.cn/nb/public/sharejump.php?type=25&uid=94142318
小,不值这个价，估计名气大而已。下次不会再来。地点不错。装修怀旧特色。龙凤餐厅东西很好吃。房间有咖啡机，不错！员工态度一般都普通及差。早餐选择太少，煎个庵列要自己不断去看，为什么不能煎好了送过来？咖啡每次要自己要求才加。停车位一直说紧致，开车出去回来可能就没有了，为什么不能登记好留位给住店客户？（结果还是都有位）。下午4，5点都还没收拾好房间，浴缸塞坏了，修好，再坏。电视太小。Wi-Fi信号弱。总开关无法关闭所有灯。冷暖水调整不畅顺。,5,2019/7/12,https://m.mafengwo.cn/nb/public/sharejump.php?type=25&uid=95277373
后思,尚可。订过的房间刚开始说没有，后面找到了说给我免费升市景房，但我订的是比市景房还贵的金尊费尔蒙房，无语。,5,2019/7/12,https://m.mafengwo.cn/nb/public/sharejump.php?type=25&uid=95275936
